{
  "schema": "gadget.assays.import.v1",
  "id": "sequence-witnesses",
  "design": {
    "question": "Compare two complete source sequences and find all bounded-mismatch placements",
    "population": "Authored sequence records",
    "selection": "Every declared record and placement",
    "limitations": [
      "These authored sequences demonstrate the methods; they are not a biological experiment"
    ]
  },
  "assays": [],
  "resources": [
    {
      "id": "queries",
      "format": "fasta",
      "source": {
        "path": "queries.fa",
        "sha256": "sha256:b7132dff8419ef5152e2b84e4255b40537b1b45838db0b54dbf871bd4147adcd"
      },
      "method": "Authored sequence demonstration"
    },
    {
      "id": "reference",
      "format": "fasta",
      "source": {
        "path": "reference.fa",
        "sha256": "sha256:3d8207994dc8d35ed83c00fe7eeddd64f523ab15cd024f72ee51bd5e85cdeb2a"
      },
      "method": "Authored sequence demonstration"
    }
  ],
  "links": []
}
